{
  "sessionId": "ses_demo_001",
  "runId": "run_demo_001",
  "mode": "fallback",
  "input": {
    "brief": "AI note assistant for founder-led teams preparing a first serious paid campaign.",
    "contextUrl": "https://example.com/founder-note-assistant",
    "inputImagePath": null,
    "targetNiche": "AI note tools for startup operators"
  },
  "sources": [
    {"sourceId": "src_alpha", "title": "Source Alpha", "url": "https://alpha.example.com/product", "domain": "alpha.example.com", "screenshotPath": null, "citationLabel": "S1"},
    {"sourceId": "src_bravo", "title": "Source Bravo", "url": "https://bravo.example.com/product", "domain": "bravo.example.com", "screenshotPath": null, "citationLabel": "S2"},
    {"sourceId": "src_charlie", "title": "Source Charlie", "url": "https://charlie.example.com/product", "domain": "charlie.example.com", "screenshotPath": null, "citationLabel": "S3"},
    {"sourceId": "src_delta", "title": "Source Delta", "url": "https://delta.example.com/product", "domain": "delta.example.com", "screenshotPath": null, "citationLabel": "S4"},
    {"sourceId": "src_echo", "title": "Source Echo", "url": "https://echo.example.com/article", "domain": "echo.example.com", "screenshotPath": null, "citationLabel": "S5"}
  ],
  "patternClusters": [
    {"clusterId": "cluster_speed", "label": "Fast recap framing", "summary": "The sampled set repeatedly leads with speed and immediate summary language.", "evidenceSourceIds": ["src_alpha", "src_charlie", "src_delta"], "evidenceCount": 3},
    {"clusterId": "cluster_autopilot", "label": "Autopilot assistant framing", "summary": "Several sources position the product as a meeting autopilot rather than a context-preserving collaborator.", "evidenceSourceIds": ["src_alpha", "src_bravo", "src_delta"], "evidenceCount": 3},
    {"clusterId": "cluster_trust", "label": "Trust and workflow confidence", "summary": "Security, reliability, and team adoption signals are common credibility anchors.", "evidenceSourceIds": ["src_bravo", "src_charlie", "src_echo"], "evidenceCount": 3}
  ],
  "overused": [
    {"label": "Save hours every week", "reason": "Generic time-saved messaging appears across multiple sources and no longer differentiates the offer by itself.", "evidenceSourceIds": ["src_alpha", "src_charlie", "src_delta"]}
  ],
  "opportunities": [
    {"label": "Preserve decision context", "rationale": "The category emphasizes automation more than decision continuity after messy conversations.", "differentiationAngle": "Position the product as the bridge from meeting chaos to shared action.", "evidenceSourceIds": ["src_alpha", "src_bravo", "src_echo"]},
    {"label": "Low-friction adoption for tiny teams", "rationale": "Small teams need speed and trust without an operations rollout project.", "differentiationAngle": "Emphasize startup-native simplicity rather than enterprise-first process.", "evidenceSourceIds": ["src_bravo", "src_delta", "src_echo"]}
  ],
  "nextTestBrief": {
    "audience": "Founders and chiefs of staff at startup teams with heavy meeting volume",
    "hook": "Your team does not need more AI notes. It needs decisions that survive the meeting.",
    "angle": "Shift from note automation to preserving context, ownership, and next steps.",
    "visualDirection": "Editorial collage of chaotic conversations resolving into one shared action board.",
    "copyDirection": "Operator-focused language that contrasts decision clarity with manual recap chaos.",
    "whyThisNow": "This test speaks directly to the current manual workaround while preserving speed and low setup burden."
  },
  "audioRecap": {
    "status": "unavailable"
  },
  "storyBlocks": [
    {"blockId": "sb_opening", "type": "narrative_text", "title": "Market pulse", "body": "The sampled market repeats the same promise cluster: fast recap, autopilot assistance, and workflow confidence.", "citationSourceIds": ["src_alpha", "src_bravo", "src_charlie"]},
    {"blockId": "sb_screenshot_group", "type": "screenshot_group", "title": "What users see first", "items": [{"itemId": "item_1", "sourceId": "src_alpha", "title": "Structured brief intake", "imagePath": "docs/assets/screenshots/01-ui-structured-brief-intake.png", "caption": "Fast strategy intake framing", "citationLabel": "S1"}, {"itemId": "item_2", "sourceId": "src_bravo", "title": "Completed strategy board", "imagePath": "docs/assets/screenshots/03-ui-result-creative-story-board.png", "caption": "Board-first output framing", "citationLabel": "S2"}]},
    {"blockId": "sb_strategy", "type": "strategy_callout", "title": "Strongest opening", "label": "Differentiate on decision clarity", "body": "The most defensible next test is to focus on what survives the meeting, not just what gets summarized.", "citationSourceIds": ["src_alpha", "src_bravo", "src_echo"]},
    {"blockId": "sb_image_asset", "type": "image_asset", "title": "Concept frame", "imagePath": "docs/assets/screenshots/02-ui-filled-brief-example.png", "alt": "Filled strategy brief example", "caption": "decision clarity after founder meeting chaos"},
    {"blockId": "sb_evidence", "type": "citation_callout", "title": "Evidence note", "claim": "The public showcase uses sanitized example sources and real local demo screenshots for proof material.", "supportingSourceIds": ["src_alpha", "src_bravo", "src_echo"]}
  ],
  "visualBlocks": [
    {"blockId": "vb_signal_meter", "type": "signal_meter", "title": "Pattern intensity snapshot", "signals": [{"signalId": "sig_automation", "label": "Automation framing", "value": 82, "tone": "warning"}, {"signalId": "sig_context", "label": "Decision clarity whitespace", "value": 74, "tone": "positive"}]}
  ]
}
